{"consumer_contract_version":"3.0","fragments":[{"field":"/","value":{"handoffs":[{"breadth_pass":true,"candidate_bucket":"research_now","candidate_role":"representative","counter_evidence":["商品価格下落やコスト上昇で株主還元の原資が減ること"],"data_date":"2026-07-31","data_quality":"partial","fundamental_confirmation_status":"price_only","generation_id":"36c2239acd07a38c378706b5f81faa2904e3cf81d42fd36859c4c27ba328d869","handoff_contract_version":"1.0","price_data_available":true,"price_signal_status":"confirmed","primary_checks":["生産量と実現価格が設備投資後の自由現金収支を維持できるか"],"quality_pass":true,"selection_reason":"石油・ガス開発の代表企業として中心的な強さを確認するためです。","theme_id":"oil_gas_exploration","theme_status":"research_now","threshold_pass":true,"ticker":"OXY","warnings":["テーマ検証の観測候補であり、売買推奨ではありません。"]},{"breadth_pass":true,"candidate_bucket":"research_now","candidate_role":"breadth_check","counter_evidence":["一社の資産構成だけが有利で、同業の現金収支が弱いこと"],"data_date":"2026-07-31","data_quality":"partial","fundamental_confirmation_status":"price_only","generation_id":"36c2239acd07a38c378706b5f81faa2904e3cf81d42fd36859c4c27ba328d869","handoff_contract_version":"1.0","price_data_available":true,"price_signal_status":"confirmed","primary_checks":["生産効率と資本規律が複数の開発企業で確認できるか"],"quality_pass":true,"selection_reason":"石油・ガス開発の別企業にも及ぶ上昇の広がりを確認するためです。","theme_id":"oil_gas_exploration","theme_status":"research_now","threshold_pass":true,"ticker":"COP","warnings":["テーマ検証の観測候補であり、売買推奨ではありません。"]}]}}],"identity":{"analysis_id":"3c4bc2da1e97a0507e0e94304780373c55b3541611e103ff45b3eab6ae506a7c","data_date":"2026-07-31","generated_at":"2026-08-02T21:48:06.755021Z","generation_id":"36c2239acd07a38c378706b5f81faa2904e3cf81d42fd36859c4c27ba328d869","hard_stop_after":"2026-08-16T21:48:06.755021Z","run_id":"3c4bc2da1e97a0507e0e94304780373c55b3541611e103ff45b3eab6ae506a7c","source_commit":"2f4aad201ab6fc58fb363ba4ee371a149a6671b3","source_sha256":"aabee7e8c8b891bbf560c631d91b601c7dd482e70e1ca40cf11c35eaf4a9e2d2","status":"success","timezone":"UTC","valid_until":"2026-08-12T21:48:06.755021Z"},"kind":"handoff","part":1,"part_count":1,"phase":6}
