{"consumer_contract_version":"3.0","fragments":[{"field":"/","value":{"handoffs":[{"breadth_pass":true,"candidate_bucket":"research_now","candidate_role":"representative","counter_evidence":["商品価格下落やコスト上昇で株主還元の原資が減ること"],"data_date":"2026-07-31","data_quality":"partial","fundamental_confirmation_status":"price_only","generation_id":"6c2260ba8b98d8fccd20d14e35fb616ff40e1d7bc1d7af296cf514e962deffa0","handoff_contract_version":"1.0","price_data_available":true,"price_signal_status":"confirmed","primary_checks":["生産量と実現価格が設備投資後の自由現金収支を維持できるか"],"quality_pass":true,"selection_reason":"石油・ガス開発の代表企業として中心的な強さを確認するためです。","theme_id":"oil_gas_exploration","theme_status":"research_now","threshold_pass":true,"ticker":"OXY","warnings":["テーマ検証の観測候補であり、売買推奨ではありません。"]},{"breadth_pass":true,"candidate_bucket":"research_now","candidate_role":"breadth_check","counter_evidence":["一社の資産構成だけが有利で、同業の現金収支が弱いこと"],"data_date":"2026-07-31","data_quality":"partial","fundamental_confirmation_status":"price_only","generation_id":"6c2260ba8b98d8fccd20d14e35fb616ff40e1d7bc1d7af296cf514e962deffa0","handoff_contract_version":"1.0","price_data_available":true,"price_signal_status":"confirmed","primary_checks":["生産効率と資本規律が複数の開発企業で確認できるか"],"quality_pass":true,"selection_reason":"石油・ガス開発の別企業にも及ぶ上昇の広がりを確認するためです。","theme_id":"oil_gas_exploration","theme_status":"research_now","threshold_pass":true,"ticker":"COP","warnings":["テーマ検証の観測候補であり、売買推奨ではありません。"]}]}}],"identity":{"analysis_id":"3c07b5c0e7a3ed0c8aabcce577be51f4906abff8755f2e1f16305b55a043dbdb","data_date":"2026-07-31","generated_at":"2026-08-03T11:55:38.864564Z","generation_id":"6c2260ba8b98d8fccd20d14e35fb616ff40e1d7bc1d7af296cf514e962deffa0","hard_stop_after":"2026-08-17T11:55:38.864564Z","run_id":"3c07b5c0e7a3ed0c8aabcce577be51f4906abff8755f2e1f16305b55a043dbdb","source_commit":"742e59c2db9c59bc4956cee6e6925060323fb825","source_sha256":"a3f410670be797e1f45928e50de23cc216c1d0717e3ffb58f6d7ed19e3b28c8b","status":"success","timezone":"UTC","valid_until":"2026-08-13T11:55:38.864564Z"},"kind":"handoff","part":1,"part_count":1,"phase":6}
