{"consumer_contract_version":"3.0","fragments":[{"field":"/overlap_clusters/26","value":{"breadth_overstatement_warning":false,"cluster_id":"d89e6516ae39","common_factor_exposure":[],"constituent_overlap_rate":0.0,"duplicate_company_candidates":[],"factor_exposure_status":"not_assessed","independence_status":"distinct","jaccard_similarity":0.0,"representative_theme":"networking_optical","shared_top_constituents":[],"theme_a":"networking_optical","theme_b":"semi_equipment","theme_return_correlation":{"minimum_observations":20,"observation_count":60,"status":"available","used_dates":["2026-05-06","2026-05-07","2026-05-08","2026-05-11","2026-05-12","2026-05-13","2026-05-14","2026-05-15","2026-05-18","2026-05-19","2026-05-20","2026-05-21","2026-05-22","2026-05-26","2026-05-27","2026-05-28","2026-05-29","2026-06-01","2026-06-02","2026-06-03","2026-06-04","2026-06-05","2026-06-08","2026-06-09","2026-06-10","2026-06-11","2026-06-12","2026-06-15","2026-06-16","2026-06-17","2026-06-18","2026-06-22","2026-06-23","2026-06-24","2026-06-25","2026-06-26","2026-06-29","2026-06-30","2026-07-01","2026-07-02","2026-07-06","2026-07-07","2026-07-08","2026-07-09","2026-07-10","2026-07-13","2026-07-14","2026-07-15","2026-07-16","2026-07-17","2026-07-20","2026-07-21","2026-07-22","2026-07-23","2026-07-24","2026-07-27","2026-07-28","2026-07-29","2026-07-30","2026-07-31"],"value":0.7997896352003089}}},{"field":"/overlap_clusters/27","value":{"breadth_overstatement_warning":false,"cluster_id":"b59e81d6528c","common_factor_exposure":[],"constituent_overlap_rate":0.0,"duplicate_company_candidates":[],"factor_exposure_status":"not_assessed","independence_status":"distinct","jaccard_similarity":0.0,"representative_theme":"nuclear_uranium","shared_top_constituents":[],"theme_a":"nuclear_uranium","theme_b":"semi_equipment","theme_return_correlation":{"minimum_observations":20,"observation_count":60,"status":"available","used_dates":["2026-05-06","2026-05-07","2026-05-08","2026-05-11","2026-05-12","2026-05-13","2026-05-14","2026-05-15","2026-05-18","2026-05-19","2026-05-20","2026-05-21","2026-05-22","2026-05-26","2026-05-27","2026-05-28","2026-05-29","2026-06-01","2026-06-02","2026-06-03","2026-06-04","2026-06-05","2026-06-08","2026-06-09","2026-06-10","2026-06-11","2026-06-12","2026-06-15","2026-06-16","2026-06-17","2026-06-18","2026-06-22","2026-06-23","2026-06-24","2026-06-25","2026-06-26","2026-06-29","2026-06-30","2026-07-01","2026-07-02","2026-07-06","2026-07-07","2026-07-08","2026-07-09","2026-07-10","2026-07-13","2026-07-14","2026-07-15","2026-07-16","2026-07-17","2026-07-20","2026-07-21","2026-07-22","2026-07-23","2026-07-24","2026-07-27","2026-07-28","2026-07-29","2026-07-30","2026-07-31"],"value":0.6876113855781231}}}],"identity":{"analysis_id":"3c4bc2da1e97a0507e0e94304780373c55b3541611e103ff45b3eab6ae506a7c","data_date":"2026-07-31","generated_at":"2026-08-02T21:48:06.755021Z","generation_id":"36c2239acd07a38c378706b5f81faa2904e3cf81d42fd36859c4c27ba328d869","hard_stop_after":"2026-08-16T21:48:06.755021Z","run_id":"3c4bc2da1e97a0507e0e94304780373c55b3541611e103ff45b3eab6ae506a7c","source_commit":"2f4aad201ab6fc58fb363ba4ee371a149a6671b3","source_sha256":"aabee7e8c8b891bbf560c631d91b601c7dd482e70e1ca40cf11c35eaf4a9e2d2","status":"success","timezone":"UTC","valid_until":"2026-08-12T21:48:06.755021Z"},"kind":"phase","part":5,"part_count":5,"phase":3}
