{"consumer_contract_version":"3.0","fragments":[{"field":"/price_path/6","value":{"display_metric":{"comparison_text":"","display_value":"-18.7%","margin_to_threshold":-0.23715737205747822,"margin_to_threshold_display":"-23.7pt","precision":1,"rank":7,"raw_value":-0.1871573720574782,"threshold":0.05,"threshold_display":"+5.0%","unit":"percent"},"fundamental_confirmation":{"adapter":"repository_point_in_time_fundamentals_v1","coverage":0.0,"fields":{"capex":{"as_of":null,"source":"repository_fixture","status":"not_available","value":null},"earnings_growth":{"as_of":null,"source":"repository_fixture","status":"not_available","value":null},"estimate_revisions":{"as_of":null,"source":"repository_fixture","status":"not_available","value":null},"management_outlook":{"as_of":null,"source":"repository_fixture","status":"not_available","value":null},"margin":{"as_of":null,"source":"repository_fixture","status":"not_available","value":null},"orders_contracts":{"as_of":null,"source":"repository_fixture","status":"not_available","value":null},"revenue_growth":{"as_of":null,"source":"repository_fixture","status":"not_available","value":null},"theme_evidence":{"as_of":null,"source":"repository_fixture","status":"not_available","value":null},"valuation":{"as_of":null,"source":"repository_fixture","status":"not_available","value":null}},"status":"unconfirmed"},"persistence":{"analysis_mode":"initial_observation","classification_churn":null,"historical_retention":null,"history_insufficient":true,"prior_generation_delta":null,"selection_status":"initial_observation","signal_persistence_weeks":null},"price_signal":{"breadth_pass":false,"candidate_bucket":"avoid_now","confirmed":false,"data_available":true,"quality_pass":true,"threshold_pass":false},"risk_adjustment":{"annualized":false,"benchmark":"SPY","benchmark_comparison":"below_or_equal","beta_adjusted_return":-0.0025615416894690228,"downside_relative_strength":-0.02365608271690331,"market_beta":3.454968636381083,"minimum_observations":20,"missing_benchmark_dates":[],"missing_theme_dates":[],"observation_count":60,"residual_momentum":-0.04978965196546658,"status":"available","used_dates":["2026-05-06","2026-05-07","2026-05-08","2026-05-11","2026-05-12","2026-05-13","2026-05-14","2026-05-15","2026-05-18","2026-05-19","2026-05-20","2026-05-21","2026-05-22","2026-05-26","2026-05-27","2026-05-28","2026-05-29","2026-06-01","2026-06-02","2026-06-03","2026-06-04","2026-06-05","2026-06-08","2026-06-09","2026-06-10","2026-06-11","2026-06-12","2026-06-15","2026-06-16","2026-06-17","2026-06-18","2026-06-22","2026-06-23","2026-06-24","2026-06-25","2026-06-26","2026-06-29","2026-06-30","2026-07-01","2026-07-02","2026-07-06","2026-07-07","2026-07-08","2026-07-09","2026-07-10","2026-07-13","2026-07-14","2026-07-15","2026-07-16","2026-07-17","2026-07-20","2026-07-21","2026-07-22","2026-07-23","2026-07-24","2026-07-27","2026-07-28","2026-07-29","2026-07-30","2026-07-31"],"volatility":0.05281164017020794,"volatility_adjusted_return":-0.008740016616307474,"window":"daily_60_observations"},"selection_stability":{"adjusted_confidence":null,"forward_return":{"horizon_weeks":4,"mean":null,"sample_size":0,"status":"not_available"},"historical_retention":null,"is_multiple_testing_correction":false,"method":"selection_stability_heuristic","percentile":0.25,"single_week_penalty":null,"status":"available","universe_size":8},"theme_display_name":"ネットワーク・光通信","theme_id":"networking_optical","threshold_assessment":{"borderline":false,"classification_change_boundary":0.05,"classification_confidence":"high","data_quality":"unknown","margin":-0.23715737205747822,"missingness":[],"observed":-0.1871573720574782,"passed":false,"signal_confidence":"high","threshold":0.05}}},{"field":"/price_path/7","value":{"display_metric":{"comparison_text":"","display_value":"-22.6%","margin_to_threshold":-0.2762549012937197,"margin_to_threshold_display":"-27.6pt","precision":1,"rank":8,"raw_value":-0.2262549012937197,"threshold":0.05,"threshold_display":"+5.0%","unit":"percent"},"fundamental_confirmation":{"adapter":"repository_point_in_time_fundamentals_v1","coverage":0.0,"fields":{"capex":{"as_of":null,"source":"repository_fixture","status":"not_available","value":null},"earnings_growth":{"as_of":null,"source":"repository_fixture","status":"not_available","value":null},"estimate_revisions":{"as_of":null,"source":"repository_fixture","status":"not_available","value":null},"management_outlook":{"as_of":null,"source":"repository_fixture","status":"not_available","value":null},"margin":{"as_of":null,"source":"repository_fixture","status":"not_available","value":null},"orders_contracts":{"as_of":null,"source":"repository_fixture","status":"not_available","value":null},"revenue_growth":{"as_of":null,"source":"repository_fixture","status":"not_available","value":null},"theme_evidence":{"as_of":null,"source":"repository_fixture","status":"not_available","value":null},"valuation":{"as_of":null,"source":"repository_fixture","status":"not_available","value":null}},"status":"unconfirmed"},"persistence":{"analysis_mode":"initial_observation","classification_churn":null,"historical_retention":null,"history_insufficient":true,"prior_generation_delta":null,"selection_status":"initial_observation","signal_persistence_weeks":null},"price_signal":{"breadth_pass":false,"candidate_bucket":"watch_recovery","confirmed":false,"data_available":true,"quality_pass":true,"threshold_pass":false},"risk_adjustment":{"annualized":false,"benchmark":"SPY","benchmark_comparison":"above","beta_adjusted_return":-0.0003570648209644117,"downside_relative_strength":-0.024742807007096343,"market_beta":4.015308992664151,"minimum_observations":20,"missing_benchmark_dates":[],"missing_theme_dates":[],"observation_count":60,"residual_momentum":-0.11906018908705165,"status":"available","used_dates":["2026-05-06","2026-05-07","2026-05-08","2026-05-11","2026-05-12","2026-05-13","2026-05-14","2026-05-15","2026-05-18","2026-05-19","2026-05-20","2026-05-21","2026-05-22","2026-05-26","2026-05-27","2026-05-28","2026-05-29","2026-06-01","2026-06-02","2026-06-03","2026-06-04","2026-06-05","2026-06-08","2026-06-09","2026-06-10","2026-06-11","2026-06-12","2026-06-15","2026-06-16","2026-06-17","2026-06-18","2026-06-22","2026-06-23","2026-06-24","2026-06-25","2026-06-26","2026-06-29","2026-06-30","2026-07-01","2026-07-02","2026-07-06","2026-07-07","2026-07-08","2026-07-09","2026-07-10","2026-07-13","2026-07-14","2026-07-15","2026-07-16","2026-07-17","2026-07-20","2026-07-21","2026-07-22","2026-07-23","2026-07-24","2026-07-27","2026-07-28","2026-07-29","2026-07-30","2026-07-31"],"volatility":0.05067559978249357,"volatility_adjusted_return":0.041114129025186304,"window":"daily_60_observations"},"selection_stability":{"adjusted_confidence":null,"forward_return":{"horizon_weeks":4,"mean":null,"sample_size":0,"status":"not_available"},"historical_retention":null,"is_multiple_testing_correction":false,"method":"selection_stability_heuristic","percentile":0.125,"single_week_penalty":null,"status":"available","universe_size":8},"theme_display_name":"半導体製造装置","theme_id":"semi_equipment","threshold_assessment":{"borderline":false,"classification_change_boundary":0.05,"classification_confidence":"high","data_quality":"unknown","margin":-0.2762549012937197,"missingness":[],"observed":-0.2262549012937197,"passed":false,"signal_confidence":"high","threshold":0.05}}}],"identity":{"analysis_id":"1358de247d71e84230463f25033c42fedb81cdae8ba307bafaf9719dfecf525f","data_date":"2026-07-31","generated_at":"2026-08-01T20:40:50.164783Z","generation_id":"b3a39afecf11c4cb04695f854bdb47d39a67d56f07c7d52d589d4503dd90a563","hard_stop_after":"2026-08-15T20:40:50.164783Z","run_id":"1358de247d71e84230463f25033c42fedb81cdae8ba307bafaf9719dfecf525f","source_commit":"2784c3f9e22f27396e9412498f6966e9b81e8c32","source_sha256":"8e2e9f686dc9da9f180a37f714c3a876b0be2ddeebe77ca97aee96f674c88d84","status":"success","timezone":"UTC","valid_until":"2026-08-11T20:40:50.164783Z"},"kind":"phase","part":3,"part_count":3,"phase":2}
