{"consumer_contract_version":"3.0","fragments":[{"field":"/","value":{"handoffs":[{"breadth_pass":true,"candidate_bucket":"research_now","candidate_role":"representative","counter_evidence":["商品価格下落やコスト上昇で株主還元の原資が減ること"],"data_date":"2026-08-03","data_quality":"partial","fundamental_confirmation_status":"price_only","generation_id":"6fa376320c04fc2d4cc4191a7ffeb500f434c4cf949dd3f9297a7ca6941f59a6","handoff_contract_version":"1.0","price_data_available":true,"price_signal_status":"confirmed","primary_checks":["生産量と実現価格が設備投資後の自由現金収支を維持できるか"],"quality_pass":true,"selection_reason":"石油・ガス開発の代表企業として中心的な強さを確認するためです。","theme_id":"oil_gas_exploration","theme_status":"research_now","threshold_pass":true,"ticker":"FANG","warnings":["テーマ検証の観測候補であり、売買推奨ではありません。"]},{"breadth_pass":true,"candidate_bucket":"research_now","candidate_role":"breadth_check","counter_evidence":["一社の資産構成だけが有利で、同業の現金収支が弱いこと"],"data_date":"2026-08-03","data_quality":"partial","fundamental_confirmation_status":"price_only","generation_id":"6fa376320c04fc2d4cc4191a7ffeb500f434c4cf949dd3f9297a7ca6941f59a6","handoff_contract_version":"1.0","price_data_available":true,"price_signal_status":"confirmed","primary_checks":["生産効率と資本規律が複数の開発企業で確認できるか"],"quality_pass":true,"selection_reason":"石油・ガス開発の別企業にも及ぶ上昇の広がりを確認するためです。","theme_id":"oil_gas_exploration","theme_status":"research_now","threshold_pass":true,"ticker":"COP","warnings":["テーマ検証の観測候補であり、売買推奨ではありません。"]}]}}],"identity":{"analysis_id":"8544cc3923e0ed84c3ec32bfc03bf9644947b2d889ac5caa6effb2765e3cdf16","data_date":"2026-08-03","generated_at":"2026-08-03T14:05:23.332412Z","generation_id":"6fa376320c04fc2d4cc4191a7ffeb500f434c4cf949dd3f9297a7ca6941f59a6","hard_stop_after":"2026-08-17T14:05:23.332412Z","run_id":"8544cc3923e0ed84c3ec32bfc03bf9644947b2d889ac5caa6effb2765e3cdf16","source_commit":"470adcd315bcea2b97c0df1c976524c5733240bb","source_sha256":"d0a10a36faf20e6c0db909459c587fea40f0c1c8fcb95b96fedec7c57c29b4c5","status":"success","timezone":"UTC","valid_until":"2026-08-13T14:05:23.332412Z"},"kind":"handoff","part":1,"part_count":1,"phase":6}
