{"consumer_contract_version":"3.0","fragments":[{"field":"/","value":{"methodology":{"methodology_id":"phase_1_authoritative_v3","notes":["producer_generated"]},"phase":1,"traceability":{"source_fields":["/themes","/v3_inputs","/meta"]}}}],"identity":{"analysis_id":"b339f8facbff1d3e1914630792af71600db4bc0fc3c86a97398bbc4f46e92b62","data_date":"2026-07-31","generated_at":"2026-08-03T09:35:58.433388Z","generation_id":"6df6bad82c5e2d0b0cd0c7cf14d597f10416fff5cc750893dd1f3a08413a4848","hard_stop_after":"2026-08-17T09:35:58.433388Z","run_id":"b339f8facbff1d3e1914630792af71600db4bc0fc3c86a97398bbc4f46e92b62","source_commit":"f950eed657f796fcaf5bf922150343cddc4f1d8c","source_sha256":"f447d6b09b93c56466ed0064226dae2a93e1c221941b1473f5bbabc60f07aef7","status":"success","timezone":"UTC","valid_until":"2026-08-13T09:35:58.433388Z"},"kind":"detail","part":1,"part_count":1,"phase":1}
