{"consumer_contract_version":"3.0","fragments":[{"field":"/phase","value":1},{"field":"/data_date_display","value":"2026-07-31"},{"field":"/generated_at_display","value":"2026-08-03T09:35:58.433388Z"},{"field":"/analysis_mode_display","value":"initial_observation"},{"field":"/flow_notice","value":"本分析でいうflowは、価格、相対強度、breadthなどから観測したローテーションの兆候であり、直接的な資金流入額・流出額を示すものではありません。"},{"field":"/coverage","value":{"configured_theme_count":8,"constituent_coverage":1.0,"evaluated_theme_count":8,"fundamental_coverage":0.0,"missing_themes":[],"optional_input_status":"not_assessed_or_partial","overlap_correlation_coverage":1.0,"partial_theme_count":0,"persistence_coverage":0.0,"price_coverage":1.0,"risk_adjustment_coverage":1.0,"status":"warning","thresholds":{"ok":0.75,"warning":0.5},"unavailable_theme_count":0,"warning":"coverage不足または任意入力未設定のため該当なしとは結論しません。"}},{"field":"/theme_assessments/0","value":{"display_metric":{"comparison_text":"","display_value":"+3.9%","margin_to_threshold":-0.010557162419481701,"margin_to_threshold_display":"-1.1pt","precision":1,"rank":1,"raw_value":0.0394428375805183,"threshold":0.05,"threshold_display":"+5.0%","unit":"percent"},"fundamental_confirmation":{"adapter":"repository_point_in_time_fundamentals_v1","coverage":0.0,"fields":{"capex":{"as_of":null,"source":"repository_fixture","status":"not_available","value":null},"earnings_growth":{"as_of":null,"source":"repository_fixture","status":"not_available","value":null},"estimate_revisions":{"as_of":null,"source":"repository_fixture","status":"not_available","value":null},"management_outlook":{"as_of":null,"source":"repository_fixture","status":"not_available","value":null},"margin":{"as_of":null,"source":"repository_fixture","status":"not_available","value":null},"orders_contracts":{"as_of":null,"source":"repository_fixture","status":"not_available","value":null},"revenue_growth":{"as_of":null,"source":"repository_fixture","status":"not_available","value":null},"theme_evidence":{"as_of":null,"source":"repository_fixture","status":"not_available","value":null},"valuation":{"as_of":null,"source":"repository_fixture","status":"not_available","value":null}},"status":"unconfirmed"},"persistence":{"analysis_mode":"initial_observation","classification_churn":null,"historical_retention":null,"history_insufficient":true,"prior_generation_delta":null,"selection_status":"initial_observation","signal_persistence_weeks":null},"price_signal":{"breadth_pass":false,"candidate_bucket":"avoid_now","confirmed":false,"data_available":true,"quality_pass":true,"threshold_pass":false},"risk_adjustment":{"annualized":false,"benchmark":"SPY","benchmark_comparison":"above","beta_adjusted_return":0.004675897454885733,"downside_relative_strength":0.006051082511264586,"market_beta":0.6971671693925733,"minimum_observations":20,"missing_benchmark_dates":[],"missing_theme_dates":[],"observation_count":60,"residual_momentum":-0.046930263136029576,"status":"available","used_dates":["2026-05-06","2026-05-07","2026-05-08","2026-05-11","2026-05-12","2026-05-13","2026-05-14","2026-05-15","2026-05-18","2026-05-19","2026-05-20","2026-05-21","2026-05-22","2026-05-26","2026-05-27","2026-05-28","2026-05-29","2026-06-01","2026-06-02","2026-06-03","2026-06-04","2026-06-05","2026-06-08","2026-06-09","2026-06-10","2026-06-11","2026-06-12","2026-06-15","2026-06-16","2026-06-17","2026-06-18","2026-06-22","2026-06-23","2026-06-24","2026-06-25","2026-06-26","2026-06-29","2026-06-30","2026-07-01","2026-07-02","2026-07-06","2026-07-07","2026-07-08","2026-07-09","2026-07-10","2026-07-13","2026-07-14","2026-07-15","2026-07-16","2026-07-17","2026-07-20","2026-07-21","2026-07-22","2026-07-23","2026-07-24","2026-07-27","2026-07-28","2026-07-29","2026-07-30","2026-07-31"],"volatility":0.0323562515548743,"volatility_adjusted_return":0.1576092071755285,"window":"daily_60_observations"},"selection_stability":{"adjusted_confidence":null,"forward_return":{"horizon_weeks":4,"mean":null,"sample_size":0,"status":"not_available"},"historical_retention":null,"is_multiple_testing_correction":false,"method":"selection_stability_heuristic","percentile":1.0,"single_week_penalty":null,"status":"available","universe_size":8},"theme_display_name":"AIソフトウェア・データ基盤","theme_id":"ai_software_data","threshold_assessment":{"borderline":true,"classification_change_boundary":0.05,"classification_confidence":"low","data_quality":"unknown","margin":-0.010557162419481701,"missingness":[],"observed":0.0394428375805183,"passed":false,"signal_confidence":"low","threshold":0.05}}},{"field":"/theme_assessments/1","value":{"display_metric":{"comparison_text":"","display_value":"+2.8%","margin_to_threshold":-0.02193927783400049,"margin_to_threshold_display":"-2.2pt","precision":1,"rank":2,"raw_value":0.028060722165999512,"threshold":0.05,"threshold_display":"+5.0%","unit":"percent"},"fundamental_confirmation":{"adapter":"repository_point_in_time_fundamentals_v1","coverage":0.0,"fields":{"capex":{"as_of":null,"source":"repository_fixture","status":"not_available","value":null},"earnings_growth":{"as_of":null,"source":"repository_fixture","status":"not_available","value":null},"estimate_revisions":{"as_of":null,"source":"repository_fixture","status":"not_available","value":null},"management_outlook":{"as_of":null,"source":"repository_fixture","status":"not_available","value":null},"margin":{"as_of":null,"source":"repository_fixture","status":"not_available","value":null},"orders_contracts":{"as_of":null,"source":"repository_fixture","status":"not_available","value":null},"revenue_growth":{"as_of":null,"source":"repository_fixture","status":"not_available","value":null},"theme_evidence":{"as_of":null,"source":"repository_fixture","status":"not_available","value":null},"valuation":{"as_of":null,"source":"repository_fixture","status":"not_available","value":null}},"status":"unconfirmed"},"persistence":{"analysis_mode":"initial_observation","classification_churn":null,"historical_retention":null,"history_insufficient":true,"prior_generation_delta":null,"selection_status":"initial_observation","signal_persistence_weeks":null},"price_signal":{"breadth_pass":true,"candidate_bucket":"avoid_now","confirmed":false,"data_available":true,"quality_pass":true,"threshold_pass":false},"risk_adjustment":{"annualized":false,"benchmark":"SPY","benchmark_comparison":"above","beta_adjusted_return":0.006540688132633797,"downside_relative_strength":0.002554287543175616,"market_beta":1.1360978811574154,"minimum_observations":20,"missing_benchmark_dates":[],"missing_theme_dates":[],"observation_count":60,"residual_momentum":-0.09245388047018838,"status":"available","used_dates":["2026-05-06","2026-05-07","2026-05-08","2026-05-11","2026-05-12","2026-05-13","2026-05-14","2026-05-15","2026-05-18","2026-05-19","2026-05-20","2026-05-21","2026-05-22","2026-05-26","2026-05-27","2026-05-28","2026-05-29","2026-06-01","2026-06-02","2026-06-03","2026-06-04","2026-06-05","2026-06-08","2026-06-09","2026-06-10","2026-06-11","2026-06-12","2026-06-15","2026-06-16","2026-06-17","2026-06-18","2026-06-22","2026-06-23","2026-06-24","2026-06-25","2026-06-26","2026-06-29","2026-06-30","2026-07-01","2026-07-02","2026-07-06","2026-07-07","2026-07-08","2026-07-09","2026-07-10","2026-07-13","2026-07-14","2026-07-15","2026-07-16","2026-07-17","2026-07-20","2026-07-21","2026-07-22","2026-07-23","2026-07-24","2026-07-27","2026-07-28","2026-07-29","2026-07-30","2026-07-31"],"volatility":0.03184810112456179,"volatility_adjusted_return":0.22705343119696667,"window":"daily_60_observations"},"selection_stability":{"adjusted_confidence":null,"forward_return":{"horizon_weeks":4,"mean":null,"sample_size":0,"status":"not_available"},"historical_retention":null,"is_multiple_testing_correction":false,"method":"selection_stability_heuristic","percentile":0.875,"single_week_penalty":null,"status":"available","universe_size":8},"theme_display_name":"サイバーセキュリティ","theme_id":"cybersecurity","threshold_assessment":{"borderline":false,"classification_change_boundary":0.05,"classification_confidence":"medium","data_quality":"unknown","margin":-0.02193927783400049,"missingness":[],"observed":0.028060722165999512,"passed":false,"signal_confidence":"medium","threshold":0.05}}}],"identity":{"analysis_id":"b339f8facbff1d3e1914630792af71600db4bc0fc3c86a97398bbc4f46e92b62","data_date":"2026-07-31","generated_at":"2026-08-03T09:35:58.433388Z","generation_id":"6df6bad82c5e2d0b0cd0c7cf14d597f10416fff5cc750893dd1f3a08413a4848","hard_stop_after":"2026-08-17T09:35:58.433388Z","run_id":"b339f8facbff1d3e1914630792af71600db4bc0fc3c86a97398bbc4f46e92b62","source_commit":"f950eed657f796fcaf5bf922150343cddc4f1d8c","source_sha256":"f447d6b09b93c56466ed0064226dae2a93e1c221941b1473f5bbabc60f07aef7","status":"success","timezone":"UTC","valid_until":"2026-08-13T09:35:58.433388Z"},"kind":"phase","part":1,"part_count":3,"phase":1}
