{"consumer_contract_version":"3.0","fragments":[{"field":"/","value":{"companies":[{"candidate_role":"representative","candidate_status":"price_only","company_name":null,"company_name_status":"not_available","counter_evidence":"商品価格下落やコスト上昇で株主還元の原資が減ること","data_quality":"partial","duplicate_theme_ids":["oil_gas_exploration"],"fundamental_confirmation_status":"price_only","non_recommendation_notice":"テーマ検証の観測候補であり、売買推奨ではありません。","primary_check":"生産量と実現価格が設備投資後の自由現金収支を維持できるか","selection_reason":"石油・ガス開発の代表企業として中心的な強さを確認するためです。","source_fields":["/company_candidates/ticker","/company_candidates/company_name","/company_candidates/selection_role","/v3_inputs/fundamentals"],"theme_display_name":"石油・ガス開発","theme_id":"oil_gas_exploration","theme_rank":1,"ticker":"OXY"},{"candidate_role":"breadth_check","candidate_status":"price_only","company_name":null,"company_name_status":"not_available","counter_evidence":"一社の資産構成だけが有利で、同業の現金収支が弱いこと","data_quality":"partial","duplicate_theme_ids":["oil_gas_exploration"],"fundamental_confirmation_status":"price_only","non_recommendation_notice":"テーマ検証の観測候補であり、売買推奨ではありません。","primary_check":"生産効率と資本規律が複数の開発企業で確認できるか","selection_reason":"石油・ガス開発の別企業にも及ぶ上昇の広がりを確認するためです。","source_fields":["/company_candidates/ticker","/company_candidates/company_name","/company_candidates/selection_role","/v3_inputs/fundamentals"],"theme_display_name":"石油・ガス開発","theme_id":"oil_gas_exploration","theme_rank":2,"ticker":"COP"}],"non_recommendation_notice":"企業候補は売買推奨ではありません。","phase":5}}],"identity":{"analysis_id":"1358de247d71e84230463f25033c42fedb81cdae8ba307bafaf9719dfecf525f","data_date":"2026-07-31","generated_at":"2026-08-01T20:40:50.164783Z","generation_id":"b3a39afecf11c4cb04695f854bdb47d39a67d56f07c7d52d589d4503dd90a563","hard_stop_after":"2026-08-15T20:40:50.164783Z","run_id":"1358de247d71e84230463f25033c42fedb81cdae8ba307bafaf9719dfecf525f","source_commit":"2784c3f9e22f27396e9412498f6966e9b81e8c32","source_sha256":"8e2e9f686dc9da9f180a37f714c3a876b0be2ddeebe77ca97aee96f674c88d84","status":"success","timezone":"UTC","valid_until":"2026-08-11T20:40:50.164783Z"},"kind":"phase","part":1,"part_count":1,"phase":5}
