{"consumer_contract_version":"3.0","fragments":[{"field":"/","value":{"methodology":{"methodology_id":"phase_2_authoritative_v3","notes":["producer_generated"]},"phase":2,"traceability":{"source_fields":["/themes","/v3_inputs","/meta"]}}}],"identity":{"analysis_id":"ddd12cd862d8798a69811acf9d711c6d25b9b22820369c3e8481914e50c33253","data_date":"2026-07-31","generated_at":"2026-08-01T21:42:46.809191Z","generation_id":"981172bcedb346c7d1199450631dd4995234e54afe560cf60ce47d63bddeb25f","hard_stop_after":"2026-08-15T21:42:46.809191Z","run_id":"ddd12cd862d8798a69811acf9d711c6d25b9b22820369c3e8481914e50c33253","source_commit":"2c79c9ffb6dbda122ad8fc1ef17ccb626567b30c","source_sha256":"a303de70af28eaa996e57ca61be7215c27655252ebfe0a10094ac74858b46230","status":"success","timezone":"UTC","valid_until":"2026-08-11T21:42:46.809191Z"},"kind":"detail","part":1,"part_count":1,"phase":2}
