{"consumer_contract_version":"3.0","fragments":[{"field":"/","value":{"methodology":{"methodology_id":"phase_5_authoritative_v3","notes":["producer_generated"]},"phase":5,"traceability":{"source_fields":["/themes","/v3_inputs","/meta"]}}}],"identity":{"analysis_id":"3c07b5c0e7a3ed0c8aabcce577be51f4906abff8755f2e1f16305b55a043dbdb","data_date":"2026-07-31","generated_at":"2026-08-03T11:55:38.864564Z","generation_id":"6c2260ba8b98d8fccd20d14e35fb616ff40e1d7bc1d7af296cf514e962deffa0","hard_stop_after":"2026-08-17T11:55:38.864564Z","run_id":"3c07b5c0e7a3ed0c8aabcce577be51f4906abff8755f2e1f16305b55a043dbdb","source_commit":"742e59c2db9c59bc4956cee6e6925060323fb825","source_sha256":"a3f410670be797e1f45928e50de23cc216c1d0717e3ffb58f6d7ed19e3b28c8b","status":"success","timezone":"UTC","valid_until":"2026-08-13T11:55:38.864564Z"},"kind":"detail","part":1,"part_count":1,"phase":5}
