{"consumer_contract_version":"3.0","fragments":[{"field":"/","value":{"methodology":{"methodology_id":"dedicated_summary_v3","notes":["no_phase5_duplication"]},"phase":6,"traceability":{"source_fields":["/market_regime","/candidate_buckets","/company_candidates","/meta"]}}}],"identity":{"analysis_id":"1358de247d71e84230463f25033c42fedb81cdae8ba307bafaf9719dfecf525f","data_date":"2026-07-31","generated_at":"2026-08-01T20:40:50.164783Z","generation_id":"b3a39afecf11c4cb04695f854bdb47d39a67d56f07c7d52d589d4503dd90a563","hard_stop_after":"2026-08-15T20:40:50.164783Z","run_id":"1358de247d71e84230463f25033c42fedb81cdae8ba307bafaf9719dfecf525f","source_commit":"2784c3f9e22f27396e9412498f6966e9b81e8c32","source_sha256":"8e2e9f686dc9da9f180a37f714c3a876b0be2ddeebe77ca97aee96f674c88d84","status":"success","timezone":"UTC","valid_until":"2026-08-11T20:40:50.164783Z"},"kind":"detail","part":1,"part_count":1,"phase":6}
