{"consumer_contract_version":"3.0","fragments":[{"field":"/","value":{"companies":[{"candidate_role":"representative","candidate_status":"price_only","company_name":null,"company_name_status":"not_available","counter_evidence":"商品価格下落やコスト上昇で株主還元の原資が減ること","data_quality":"partial","duplicate_theme_ids":["oil_gas_exploration"],"fundamental_confirmation_status":"price_only","non_recommendation_notice":"テーマ検証の観測候補であり、売買推奨ではありません。","primary_check":"生産量と実現価格が設備投資後の自由現金収支を維持できるか","selection_reason":"石油・ガス開発の代表企業として中心的な強さを確認するためです。","source_fields":["/company_candidates/ticker","/company_candidates/company_name","/company_candidates/selection_role","/v3_inputs/fundamentals"],"theme_display_name":"石油・ガス開発","theme_id":"oil_gas_exploration","theme_rank":1,"ticker":"FANG"},{"candidate_role":"breadth_check","candidate_status":"price_only","company_name":null,"company_name_status":"not_available","counter_evidence":"一社の資産構成だけが有利で、同業の現金収支が弱いこと","data_quality":"partial","duplicate_theme_ids":["oil_gas_exploration"],"fundamental_confirmation_status":"price_only","non_recommendation_notice":"テーマ検証の観測候補であり、売買推奨ではありません。","primary_check":"生産効率と資本規律が複数の開発企業で確認できるか","selection_reason":"石油・ガス開発の別企業にも及ぶ上昇の広がりを確認するためです。","source_fields":["/company_candidates/ticker","/company_candidates/company_name","/company_candidates/selection_role","/v3_inputs/fundamentals"],"theme_display_name":"石油・ガス開発","theme_id":"oil_gas_exploration","theme_rank":2,"ticker":"COP"}],"non_recommendation_notice":"企業候補は売買推奨ではありません。","phase":5}}],"identity":{"analysis_id":"8544cc3923e0ed84c3ec32bfc03bf9644947b2d889ac5caa6effb2765e3cdf16","data_date":"2026-08-03","generated_at":"2026-08-03T14:05:23.332412Z","generation_id":"6fa376320c04fc2d4cc4191a7ffeb500f434c4cf949dd3f9297a7ca6941f59a6","hard_stop_after":"2026-08-17T14:05:23.332412Z","run_id":"8544cc3923e0ed84c3ec32bfc03bf9644947b2d889ac5caa6effb2765e3cdf16","source_commit":"470adcd315bcea2b97c0df1c976524c5733240bb","source_sha256":"d0a10a36faf20e6c0db909459c587fea40f0c1c8fcb95b96fedec7c57c29b4c5","status":"success","timezone":"UTC","valid_until":"2026-08-13T14:05:23.332412Z"},"kind":"phase","part":1,"part_count":1,"phase":5}
