{"consumer_contract_version":"3.0","fragments":[{"field":"/","value":{"methodology":{"methodology_id":"phase_1_authoritative_v3","notes":["producer_generated"]},"phase":1,"traceability":{"source_fields":["/themes","/v3_inputs","/meta"]}}}],"identity":{"analysis_id":"8544cc3923e0ed84c3ec32bfc03bf9644947b2d889ac5caa6effb2765e3cdf16","data_date":"2026-08-03","generated_at":"2026-08-03T14:05:23.332412Z","generation_id":"6fa376320c04fc2d4cc4191a7ffeb500f434c4cf949dd3f9297a7ca6941f59a6","hard_stop_after":"2026-08-17T14:05:23.332412Z","run_id":"8544cc3923e0ed84c3ec32bfc03bf9644947b2d889ac5caa6effb2765e3cdf16","source_commit":"470adcd315bcea2b97c0df1c976524c5733240bb","source_sha256":"d0a10a36faf20e6c0db909459c587fea40f0c1c8fcb95b96fedec7c57c29b4c5","status":"success","timezone":"UTC","valid_until":"2026-08-13T14:05:23.332412Z"},"kind":"detail","part":1,"part_count":1,"phase":1}
