{"consumer_contract_version":"3.0","fragments":[{"field":"/","value":{"handoffs":[{"breadth_pass":true,"candidate_bucket":"research_now","candidate_role":"representative","counter_evidence":["商品価格下落やコスト上昇で株主還元の原資が減ること"],"data_date":"2026-07-31","data_quality":"partial","fundamental_confirmation_status":"price_only","generation_id":"b3a39afecf11c4cb04695f854bdb47d39a67d56f07c7d52d589d4503dd90a563","handoff_contract_version":"1.0","price_data_available":true,"price_signal_status":"confirmed","primary_checks":["生産量と実現価格が設備投資後の自由現金収支を維持できるか"],"quality_pass":true,"selection_reason":"石油・ガス開発の代表企業として中心的な強さを確認するためです。","theme_id":"oil_gas_exploration","theme_status":"research_now","threshold_pass":true,"ticker":"OXY","warnings":["テーマ検証の観測候補であり、売買推奨ではありません。"]},{"breadth_pass":true,"candidate_bucket":"research_now","candidate_role":"breadth_check","counter_evidence":["一社の資産構成だけが有利で、同業の現金収支が弱いこと"],"data_date":"2026-07-31","data_quality":"partial","fundamental_confirmation_status":"price_only","generation_id":"b3a39afecf11c4cb04695f854bdb47d39a67d56f07c7d52d589d4503dd90a563","handoff_contract_version":"1.0","price_data_available":true,"price_signal_status":"confirmed","primary_checks":["生産効率と資本規律が複数の開発企業で確認できるか"],"quality_pass":true,"selection_reason":"石油・ガス開発の別企業にも及ぶ上昇の広がりを確認するためです。","theme_id":"oil_gas_exploration","theme_status":"research_now","threshold_pass":true,"ticker":"COP","warnings":["テーマ検証の観測候補であり、売買推奨ではありません。"]}]}}],"identity":{"analysis_id":"1358de247d71e84230463f25033c42fedb81cdae8ba307bafaf9719dfecf525f","data_date":"2026-07-31","generated_at":"2026-08-01T20:40:50.164783Z","generation_id":"b3a39afecf11c4cb04695f854bdb47d39a67d56f07c7d52d589d4503dd90a563","hard_stop_after":"2026-08-15T20:40:50.164783Z","run_id":"1358de247d71e84230463f25033c42fedb81cdae8ba307bafaf9719dfecf525f","source_commit":"2784c3f9e22f27396e9412498f6966e9b81e8c32","source_sha256":"8e2e9f686dc9da9f180a37f714c3a876b0be2ddeebe77ca97aee96f674c88d84","status":"success","timezone":"UTC","valid_until":"2026-08-11T20:40:50.164783Z"},"kind":"handoff","part":1,"part_count":1,"phase":6}
