{"consumer_contract_version":"3.0","fragments":[{"field":"/","value":{"classification_summary":[{"classification":"research_now","display_name":"今調べる候補","status":"present","theme_ids":["oil_gas_exploration"]},{"classification":"watch_recovery","display_name":"条件改善待ち","status":"present","theme_ids":["regional_banks","ai_semis","semi_equipment"]},{"classification":"long_term_context_price_weak","display_name":"長期文脈はあるが価格が弱い候補","status":"none_assessed","theme_ids":[]},{"classification":"avoid_now","display_name":"現時点では調査優先度が低い候補","status":"present","theme_ids":["biotechnology","homebuilders","infrastructure_construction","retail","transportation","ai_software_data","cybersecurity","dc_power_infra","defense","networking_optical","nuclear_uranium"]}],"explicit_avoid":[],"phase":4}}],"identity":{"analysis_id":"ddd12cd862d8798a69811acf9d711c6d25b9b22820369c3e8481914e50c33253","data_date":"2026-07-31","generated_at":"2026-08-01T21:42:46.809191Z","generation_id":"981172bcedb346c7d1199450631dd4995234e54afe560cf60ce47d63bddeb25f","hard_stop_after":"2026-08-15T21:42:46.809191Z","run_id":"ddd12cd862d8798a69811acf9d711c6d25b9b22820369c3e8481914e50c33253","source_commit":"2c79c9ffb6dbda122ad8fc1ef17ccb626567b30c","source_sha256":"a303de70af28eaa996e57ca61be7215c27655252ebfe0a10094ac74858b46230","status":"success","timezone":"UTC","valid_until":"2026-08-11T21:42:46.809191Z"},"kind":"phase","part":1,"part_count":1,"phase":4}
