{"consumer_contract_version":"3.0","fragments":[{"field":"/","value":{"handoffs":[{"breadth_pass":true,"candidate_bucket":"research_now","candidate_role":"representative","counter_evidence":["商品価格下落やコスト上昇で株主還元の原資が減ること"],"data_date":"2026-07-31","data_quality":"partial","fundamental_confirmation_status":"price_only","generation_id":"6df6bad82c5e2d0b0cd0c7cf14d597f10416fff5cc750893dd1f3a08413a4848","handoff_contract_version":"1.0","price_data_available":true,"price_signal_status":"confirmed","primary_checks":["生産量と実現価格が設備投資後の自由現金収支を維持できるか"],"quality_pass":true,"selection_reason":"石油・ガス開発の代表企業として中心的な強さを確認するためです。","theme_id":"oil_gas_exploration","theme_status":"research_now","threshold_pass":true,"ticker":"OXY","warnings":["テーマ検証の観測候補であり、売買推奨ではありません。"]},{"breadth_pass":true,"candidate_bucket":"research_now","candidate_role":"breadth_check","counter_evidence":["一社の資産構成だけが有利で、同業の現金収支が弱いこと"],"data_date":"2026-07-31","data_quality":"partial","fundamental_confirmation_status":"price_only","generation_id":"6df6bad82c5e2d0b0cd0c7cf14d597f10416fff5cc750893dd1f3a08413a4848","handoff_contract_version":"1.0","price_data_available":true,"price_signal_status":"confirmed","primary_checks":["生産効率と資本規律が複数の開発企業で確認できるか"],"quality_pass":true,"selection_reason":"石油・ガス開発の別企業にも及ぶ上昇の広がりを確認するためです。","theme_id":"oil_gas_exploration","theme_status":"research_now","threshold_pass":true,"ticker":"COP","warnings":["テーマ検証の観測候補であり、売買推奨ではありません。"]}]}}],"identity":{"analysis_id":"b339f8facbff1d3e1914630792af71600db4bc0fc3c86a97398bbc4f46e92b62","data_date":"2026-07-31","generated_at":"2026-08-03T09:35:58.433388Z","generation_id":"6df6bad82c5e2d0b0cd0c7cf14d597f10416fff5cc750893dd1f3a08413a4848","hard_stop_after":"2026-08-17T09:35:58.433388Z","run_id":"b339f8facbff1d3e1914630792af71600db4bc0fc3c86a97398bbc4f46e92b62","source_commit":"f950eed657f796fcaf5bf922150343cddc4f1d8c","source_sha256":"f447d6b09b93c56466ed0064226dae2a93e1c221941b1473f5bbabc60f07aef7","status":"success","timezone":"UTC","valid_until":"2026-08-13T09:35:58.433388Z"},"kind":"handoff","part":1,"part_count":1,"phase":6}
