{"consumer_contract_version":"3.0","fragments":[{"field":"/overlap_clusters/26","value":{"breadth_overstatement_warning":false,"cluster_id":"d89e6516ae39","common_factor_exposure":[],"constituent_overlap_rate":0.0,"duplicate_company_candidates":[],"factor_exposure_status":"not_assessed","independence_status":"distinct","jaccard_similarity":0.0,"representative_theme":"networking_optical","shared_top_constituents":[],"theme_a":"networking_optical","theme_b":"semi_equipment","theme_return_correlation":{"minimum_observations":20,"observation_count":60,"status":"available","used_dates":["2026-05-06","2026-05-07","2026-05-08","2026-05-11","2026-05-12","2026-05-13","2026-05-14","2026-05-15","2026-05-18","2026-05-19","2026-05-20","2026-05-21","2026-05-22","2026-05-26","2026-05-27","2026-05-28","2026-05-29","2026-06-01","2026-06-02","2026-06-03","2026-06-04","2026-06-05","2026-06-08","2026-06-09","2026-06-10","2026-06-11","2026-06-12","2026-06-15","2026-06-16","2026-06-17","2026-06-18","2026-06-22","2026-06-23","2026-06-24","2026-06-25","2026-06-26","2026-06-29","2026-06-30","2026-07-01","2026-07-02","2026-07-06","2026-07-07","2026-07-08","2026-07-09","2026-07-10","2026-07-13","2026-07-14","2026-07-15","2026-07-16","2026-07-17","2026-07-20","2026-07-21","2026-07-22","2026-07-23","2026-07-24","2026-07-27","2026-07-28","2026-07-29","2026-07-30","2026-07-31"],"value":0.7997896352003089}}},{"field":"/overlap_clusters/27","value":{"breadth_overstatement_warning":false,"cluster_id":"b59e81d6528c","common_factor_exposure":[],"constituent_overlap_rate":0.0,"duplicate_company_candidates":[],"factor_exposure_status":"not_assessed","independence_status":"distinct","jaccard_similarity":0.0,"representative_theme":"nuclear_uranium","shared_top_constituents":[],"theme_a":"nuclear_uranium","theme_b":"semi_equipment","theme_return_correlation":{"minimum_observations":20,"observation_count":60,"status":"available","used_dates":["2026-05-06","2026-05-07","2026-05-08","2026-05-11","2026-05-12","2026-05-13","2026-05-14","2026-05-15","2026-05-18","2026-05-19","2026-05-20","2026-05-21","2026-05-22","2026-05-26","2026-05-27","2026-05-28","2026-05-29","2026-06-01","2026-06-02","2026-06-03","2026-06-04","2026-06-05","2026-06-08","2026-06-09","2026-06-10","2026-06-11","2026-06-12","2026-06-15","2026-06-16","2026-06-17","2026-06-18","2026-06-22","2026-06-23","2026-06-24","2026-06-25","2026-06-26","2026-06-29","2026-06-30","2026-07-01","2026-07-02","2026-07-06","2026-07-07","2026-07-08","2026-07-09","2026-07-10","2026-07-13","2026-07-14","2026-07-15","2026-07-16","2026-07-17","2026-07-20","2026-07-21","2026-07-22","2026-07-23","2026-07-24","2026-07-27","2026-07-28","2026-07-29","2026-07-30","2026-07-31"],"value":0.6876113855781231}}}],"identity":{"analysis_id":"3c07b5c0e7a3ed0c8aabcce577be51f4906abff8755f2e1f16305b55a043dbdb","data_date":"2026-07-31","generated_at":"2026-08-03T11:55:38.864564Z","generation_id":"6c2260ba8b98d8fccd20d14e35fb616ff40e1d7bc1d7af296cf514e962deffa0","hard_stop_after":"2026-08-17T11:55:38.864564Z","run_id":"3c07b5c0e7a3ed0c8aabcce577be51f4906abff8755f2e1f16305b55a043dbdb","source_commit":"742e59c2db9c59bc4956cee6e6925060323fb825","source_sha256":"a3f410670be797e1f45928e50de23cc216c1d0717e3ffb58f6d7ed19e3b28c8b","status":"success","timezone":"UTC","valid_until":"2026-08-13T11:55:38.864564Z"},"kind":"phase","part":5,"part_count":5,"phase":3}
