{"consumer_contract_version":"3.0","fragments":[{"field":"/","value":{"analysis_mode_display":"initial_observation","classification_summary":[{"classification":"research_now","display_name":"今調べる候補","status":"present","theme_ids":["oil_gas_exploration"]},{"classification":"watch_recovery","display_name":"条件改善待ち","status":"present","theme_ids":["regional_banks","ai_semis","semi_equipment"]},{"classification":"long_term_context_price_weak","display_name":"長期文脈はあるが価格が弱い候補","status":"none_assessed","theme_ids":[]},{"classification":"avoid_now","display_name":"現時点では調査優先度が低い候補","status":"present","theme_ids":["biotechnology","homebuilders","infrastructure_construction","retail","transportation","ai_software_data","cybersecurity","dc_power_infra","defense","networking_optical","nuclear_uranium"]}],"company_summary":[{"candidate_role":"representative","theme_id":"oil_gas_exploration","ticker":"OXY"},{"candidate_role":"breadth_check","theme_id":"oil_gas_exploration","ticker":"COP"}],"data_date_display":"2026-07-31","generated_at_display":"2026-08-02T21:48:06.755021Z","main_cautions":["本分析でいうflowは、価格、相対強度、breadthなどから観測したローテーションの兆候であり、直接的な資金流入額・流出額を示すものではありません。","coverage不足または任意入力未設定のため該当なしとは結論しません。"],"market_conclusion":"市場分類: real_asset_leadership","next_update_checks":["相対強度、breadth、threshold marginの変化"],"phase":6,"research_priorities":["oil_gas_exploration"]}}],"identity":{"analysis_id":"3c4bc2da1e97a0507e0e94304780373c55b3541611e103ff45b3eab6ae506a7c","data_date":"2026-07-31","generated_at":"2026-08-02T21:48:06.755021Z","generation_id":"36c2239acd07a38c378706b5f81faa2904e3cf81d42fd36859c4c27ba328d869","hard_stop_after":"2026-08-16T21:48:06.755021Z","run_id":"3c4bc2da1e97a0507e0e94304780373c55b3541611e103ff45b3eab6ae506a7c","source_commit":"2f4aad201ab6fc58fb363ba4ee371a149a6671b3","source_sha256":"aabee7e8c8b891bbf560c631d91b601c7dd482e70e1ca40cf11c35eaf4a9e2d2","status":"success","timezone":"UTC","valid_until":"2026-08-12T21:48:06.755021Z"},"kind":"phase","part":1,"part_count":1,"phase":6}
