{"consumer_contract_version":"3.0","fragments":[{"field":"/","value":{"classification_summary":[{"classification":"research_now","display_name":"今調べる候補","status":"present","theme_ids":["oil_gas_exploration"]},{"classification":"watch_recovery","display_name":"条件改善待ち","status":"present","theme_ids":["transportation","ai_semis","semi_equipment"]},{"classification":"long_term_context_price_weak","display_name":"長期文脈はあるが価格が弱い候補","status":"none_assessed","theme_ids":[]},{"classification":"avoid_now","display_name":"現時点では調査優先度が低い候補","status":"present","theme_ids":["biotechnology","homebuilders","infrastructure_construction","regional_banks","retail","ai_software_data","cybersecurity","dc_power_infra","defense","networking_optical","nuclear_uranium"]}],"explicit_avoid":[],"phase":4}}],"identity":{"analysis_id":"8544cc3923e0ed84c3ec32bfc03bf9644947b2d889ac5caa6effb2765e3cdf16","data_date":"2026-08-03","generated_at":"2026-08-03T14:05:23.332412Z","generation_id":"6fa376320c04fc2d4cc4191a7ffeb500f434c4cf949dd3f9297a7ca6941f59a6","hard_stop_after":"2026-08-17T14:05:23.332412Z","run_id":"8544cc3923e0ed84c3ec32bfc03bf9644947b2d889ac5caa6effb2765e3cdf16","source_commit":"470adcd315bcea2b97c0df1c976524c5733240bb","source_sha256":"d0a10a36faf20e6c0db909459c587fea40f0c1c8fcb95b96fedec7c57c29b4c5","status":"success","timezone":"UTC","valid_until":"2026-08-13T14:05:23.332412Z"},"kind":"phase","part":1,"part_count":1,"phase":4}
