{"consumer_contract_version":"3.0","fragments":[{"field":"/","value":{"methodology":{"methodology_id":"dedicated_summary_v3","notes":["no_phase5_duplication"]},"phase":6,"traceability":{"source_fields":["/market_regime","/candidate_buckets","/company_candidates","/meta"]}}}],"identity":{"analysis_id":"3c4bc2da1e97a0507e0e94304780373c55b3541611e103ff45b3eab6ae506a7c","data_date":"2026-07-31","generated_at":"2026-08-02T21:48:06.755021Z","generation_id":"36c2239acd07a38c378706b5f81faa2904e3cf81d42fd36859c4c27ba328d869","hard_stop_after":"2026-08-16T21:48:06.755021Z","run_id":"3c4bc2da1e97a0507e0e94304780373c55b3541611e103ff45b3eab6ae506a7c","source_commit":"2f4aad201ab6fc58fb363ba4ee371a149a6671b3","source_sha256":"aabee7e8c8b891bbf560c631d91b601c7dd482e70e1ca40cf11c35eaf4a9e2d2","status":"success","timezone":"UTC","valid_until":"2026-08-12T21:48:06.755021Z"},"kind":"detail","part":1,"part_count":1,"phase":6}
